{
  "schema_version": 1,
  "id": "ubuntu-26.04",
  "status": "locked",
  "distribution": "ubuntu",
  "distribution_version": "26.04",
  "base": {
    "repository": "docker.io/library/ubuntu",
    "tag": "resolute-20260724.1",
    "index_digest": "sha256:678c6550cc43645e08669028bc177f50be4e7c5b8cca677067b1914d4afc7a03",
    "manifests": {
      "amd64": "sha256:7b202b0e2e0028c6250f5fcf41d04df492d145a1654c6995a6553f0c1f6f1960",
      "arm64": "sha256:3fe5b610f5c41eeeb56c2995bd4afb4990ac5b80dc980e33f9251eaaa8013615"
    }
  },
  "package_repositories": [
    {
      "id": "resolute",
      "kind": "ubuntu-snapshot",
      "metadata": {
        "amd64": {
          "url": "https://snapshot.ubuntu.com/ubuntu/20260724T000000Z/dists/resolute/InRelease",
          "sha256": "45f95ce276cdba3e41870516a130e03c58b8b7a79e9546b0efe9e526d255740c"
        },
        "arm64": {
          "url": "https://snapshot.ubuntu.com/ubuntu/20260724T000000Z/dists/resolute/InRelease",
          "sha256": "45f95ce276cdba3e41870516a130e03c58b8b7a79e9546b0efe9e526d255740c"
        }
      }
    },
    {
      "id": "resolute-updates",
      "kind": "ubuntu-snapshot",
      "metadata": {
        "amd64": {
          "url": "https://snapshot.ubuntu.com/ubuntu/20260724T000000Z/dists/resolute-updates/InRelease",
          "sha256": "70e63f56e66b2e2629dfdcf398cfb55a71d8438f9aa87c6cde8312f0b34a944a"
        },
        "arm64": {
          "url": "https://snapshot.ubuntu.com/ubuntu/20260724T000000Z/dists/resolute-updates/InRelease",
          "sha256": "70e63f56e66b2e2629dfdcf398cfb55a71d8438f9aa87c6cde8312f0b34a944a"
        }
      }
    },
    {
      "id": "resolute-security",
      "kind": "ubuntu-snapshot",
      "metadata": {
        "amd64": {
          "url": "https://snapshot.ubuntu.com/ubuntu/20260724T000000Z/dists/resolute-security/InRelease",
          "sha256": "30b397fee484875748558533042c502f4df60776d5cae652f28d7e196d2d1796"
        },
        "arm64": {
          "url": "https://snapshot.ubuntu.com/ubuntu/20260724T000000Z/dists/resolute-security/InRelease",
          "sha256": "30b397fee484875748558533042c502f4df60776d5cae652f28d7e196d2d1796"
        }
      }
    },
    {
      "id": "resolute-backports",
      "kind": "ubuntu-snapshot",
      "metadata": {
        "amd64": {
          "url": "https://snapshot.ubuntu.com/ubuntu/20260724T000000Z/dists/resolute-backports/InRelease",
          "sha256": "b5105f9b273e83dbaabe95cbbceb724264b375709b434af654023896dcc7f8ec"
        },
        "arm64": {
          "url": "https://snapshot.ubuntu.com/ubuntu/20260724T000000Z/dists/resolute-backports/InRelease",
          "sha256": "b5105f9b273e83dbaabe95cbbceb724264b375709b434af654023896dcc7f8ec"
        }
      }
    }
  ],
  "packages": {
    "amd64": [
      "bash=5.3-2ubuntu1",
      "bind9-dnsutils=1:9.20.18-1ubuntu2.1",
      "bzip2=1.0.8-6build2",
      "ca-certificates=20260601~26.04.1",
      "curl=8.18.0-1ubuntu2.3",
      "diffutils=1:3.12-1",
      "file=1:5.46-5build2",
      "findutils=4.10.0-3build2",
      "git=1:2.53.0-1ubuntu1",
      "gzip=1.14-1~exp2ubuntu1.1",
      "iproute2=6.19.0-1ubuntu1.1",
      "iputils-ping=3:20250605-1ubuntu1",
      "jq=1.8.1-4ubuntu2",
      "lsof=4.99.4+dfsg-2build2",
      "netcat-openbsd=1.234-1",
      "openssh-client=1:10.2p1-2ubuntu3.5",
      "passwd=1:4.17.4-2ubuntu3",
      "patch=2.8-2build1",
      "procps=2:4.0.4-9ubuntu1",
      "psmisc=23.7-2ubuntu2",
      "ripgrep=15.1.0-1ubuntu1",
      "tar=1.35+dfsg-4ubuntu0.4",
      "tzdata=2026b-0ubuntu0.26.04.1",
      "unzip=6.0-29ubuntu1",
      "xz-utils=5.8.3-1"
    ],
    "arm64": [
      "bash=5.3-2ubuntu1",
      "bind9-dnsutils=1:9.20.18-1ubuntu2.1",
      "bzip2=1.0.8-6build2",
      "ca-certificates=20260601~26.04.1",
      "curl=8.18.0-1ubuntu2.3",
      "diffutils=1:3.12-1",
      "file=1:5.46-5build2",
      "findutils=4.10.0-3build2",
      "git=1:2.53.0-1ubuntu1",
      "gzip=1.14-1~exp2ubuntu1.1",
      "iproute2=6.19.0-1ubuntu1.1",
      "iputils-ping=3:20250605-1ubuntu1",
      "jq=1.8.1-4ubuntu2",
      "lsof=4.99.4+dfsg-2build2",
      "netcat-openbsd=1.234-1",
      "openssh-client=1:10.2p1-2ubuntu3.5",
      "passwd=1:4.17.4-2ubuntu3",
      "patch=2.8-2build1",
      "procps=2:4.0.4-9ubuntu1",
      "psmisc=23.7-2ubuntu2",
      "ripgrep=15.1.0-1ubuntu1",
      "tar=1.35+dfsg-4ubuntu0.4",
      "tzdata=2026b-0ubuntu0.26.04.1",
      "unzip=6.0-29ubuntu1",
      "xz-utils=5.8.3-1"
    ]
  }
}
